{
  "artifacts": [
    {
      "artifact_id": "01-source",
      "availability": "hash_reference_only",
      "content_sha256": "5cf3d557ce9a3e433696d71a1dad8d9d6073c7184152fd1393e3d80b688ef489",
      "media_type": "application/json",
      "object_sha256": "9d12179c93ca996f1d17f5e4eb1f07cc033499f7ea4e60ac314c39f81e6d5307",
      "role": "source",
      "schema_id": "sidscope.fixture.source.v1",
      "schema_revision": "1.0.0",
      "size_bytes": 100
    },
    {
      "artifact_id": "02-data",
      "availability": "hash_reference_only",
      "content_sha256": "61fef1271914f7ffb57d025faa8e03cacc5bb567ac556075dcb0aaee9035406d",
      "media_type": "application/json",
      "object_sha256": "6570d3004611a23335e47fe62c7925883a1c4f0c553b80606d943a0fb5cbafdc",
      "role": "data",
      "schema_id": "sidscope.fixture.data.v1",
      "schema_revision": "1.0.0",
      "size_bytes": 200
    },
    {
      "artifact_id": "03-sid",
      "availability": "hash_reference_only",
      "content_sha256": "8c04f3d98e8fd9609469ec5d45257d6635ac5f502d729e30ca4a948ed10c9f6b",
      "media_type": "application/json",
      "object_sha256": "a5a3ef9648c1b1813eb9a40e3b17a08042420f1c6a7588fc2c4fae2cb9d97b7a",
      "role": "sid",
      "schema_id": "sidscope.fixture.sid.v1",
      "schema_revision": "1.0.0",
      "size_bytes": 300
    },
    {
      "artifact_id": "04-run",
      "availability": "hash_reference_only",
      "content_sha256": "c7d6af8e53fa30edd3a542407f67d994e969dd78b6478023d075045b9af26266",
      "media_type": "application/json",
      "object_sha256": "08d3318fc19713500837f4491d2fc5dfb087774056510bf168c8fb22036c8b42",
      "role": "run",
      "schema_id": "sidscope.fixture.run.v1",
      "schema_revision": "1.0.0",
      "size_bytes": 400
    },
    {
      "artifact_id": "05-checkpoint",
      "availability": "hash_reference_only",
      "content_sha256": "a5fa88fe3db7265f5d840f8f1903cfc281b26c3a6bcb5cf1e68449d641f79acb",
      "media_type": "application/json",
      "object_sha256": "dfbceac00dc92d1cbfb72132db0fa8eef82bc45955a7cac683fa8a880f914b96",
      "role": "checkpoint",
      "schema_id": "sidscope.fixture.checkpoint.v1",
      "schema_revision": "1.0.0",
      "size_bytes": 500
    },
    {
      "artifact_id": "06-trace",
      "availability": "hash_reference_only",
      "content_sha256": "030be09b1dc580ff43650664bb9dc1a390534f086b68b1352aa0fe1742bbc364",
      "media_type": "application/json",
      "object_sha256": "1ff6d8279f9ebd108ef02cbcd13dda6646444532a10577275a3d913199d3c2db",
      "role": "trace",
      "schema_id": "sidscope.fixture.trace.v1",
      "schema_revision": "1.0.0",
      "size_bytes": 600
    },
    {
      "artifact_id": "07-diagnostics",
      "availability": "hash_reference_only",
      "content_sha256": "0724847ea0a1b150473f76c8238c2189086c08d078ff9b1a6bf76ed643be03fe",
      "media_type": "application/json",
      "object_sha256": "5d77019f30aacf5780af0128113d8d0408eac3b44ffb50d6416829a5d3d00fdc",
      "role": "diagnostics",
      "schema_id": "sidscope.fixture.diagnostics.v1",
      "schema_revision": "1.0.0",
      "size_bytes": 700
    },
    {
      "artifact_id": "08-conformance",
      "availability": "embedded_public",
      "content_sha256": "f79d18376c006c025542f9f4fa6651e8f852274b758399c7e852761f8b383ffe",
      "media_type": "application/json",
      "object_sha256": "6db2891de4a9b0436b7aa0aaff892c5c2c0fe976595709c20dd4c7023a3826e3",
      "role": "conformance",
      "schema_id": "sidscope.fixture.conformance.v1",
      "schema_revision": "1.0.0",
      "size_bytes": 89
    }
  ],
  "bundle_id": "fixture:rpg:baseline",
  "compatibility": {
    "dataset_identity_sha256": "1111111111111111111111111111111111111111111111111111111111111111",
    "evaluation_cutoff": 10,
    "publication_depth": 100,
    "rank_semantics": "exact_with_censoring",
    "target_universe_sha256": "2222222222222222222222222222222222222222222222222222222222222222"
  },
  "content_sha256": "9deb5dd414c109d1d6632c387e45b67b3172628940b78f1549885d0cc5718c40",
  "privacy": {
    "absolute_private_paths_exported": false,
    "checkpoint_payload_exported": false,
    "source_item_ids_exported": false,
    "source_user_ids_exported": false
  },
  "producer": {
    "name": "sidscope.fixture",
    "version": "1.4.0.dev0"
  },
  "profile_binding": {
    "conformance_report_sha256": "f79d18376c006c025542f9f4fa6651e8f852274b758399c7e852761f8b383ffe",
    "profile_id": "family.parallel_graph_token_set.v1",
    "profile_revision": "1.0.0"
  },
  "provenance_edges": [
    {
      "from_artifact": "01-source",
      "relation": "produces",
      "to_artifact": "02-data"
    },
    {
      "from_artifact": "02-data",
      "relation": "produces",
      "to_artifact": "03-sid"
    },
    {
      "from_artifact": "03-sid",
      "relation": "produces",
      "to_artifact": "04-run"
    },
    {
      "from_artifact": "04-run",
      "relation": "produces",
      "to_artifact": "05-checkpoint"
    },
    {
      "from_artifact": "05-checkpoint",
      "relation": "produces",
      "to_artifact": "06-trace"
    },
    {
      "from_artifact": "06-trace",
      "relation": "produces",
      "to_artifact": "07-diagnostics"
    },
    {
      "from_artifact": "07-diagnostics",
      "relation": "produces",
      "to_artifact": "08-conformance"
    }
  ],
  "result_card": {
    "compute": {
      "candidate_count": 100,
      "latency_ms": 12.5,
      "nfe": 10
    },
    "failure_counts": {
      "generation_search_miss": 7,
      "resolution_loss": 1,
      "success": 2
    },
    "overall_metrics": {
      "hit_at_10": 0.2,
      "ndcg_at_10": 0.1
    },
    "rank_observations": {
      "censored_count": 8,
      "exact_count": 2,
      "exact_ranks": [
        3,
        37
      ]
    },
    "slice_metrics": {
      "gap_gt_365d": {
        "hit_at_10": 0.1,
        "ndcg_at_10": 0.05
      },
      "overall": {
        "hit_at_10": 0.2,
        "ndcg_at_10": 0.1
      }
    }
  },
  "schema": "sidscope.evidence_bundle.v1",
  "schema_revision": "1.0.0",
  "subject": {
    "adapter_id": "rpg-fixture-a",
    "method_family": "parallel_graph_token_set"
  },
  "supersedes": []
}
