{"artifacts":[{"artifact_id":"artifact:0:source","availability":"hash_reference_only","content_sha256":"0000000000000000000000000000000000000000000000000000000000000014","media_type":"application/json","object_sha256":"0000000000000000000000000000000000000000000000000000000000000028","role":"source","schema_id":"sidscope.source_identity.v1","schema_revision":"1.0.0","size_bytes":100},{"artifact_id":"artifact:1:data","availability":"hash_reference_only","content_sha256":"0000000000000000000000000000000000000000000000000000000000000015","media_type":"application/json","object_sha256":"0000000000000000000000000000000000000000000000000000000000000029","role":"data","schema_id":"sidscope.prepared_dataset.v1","schema_revision":"1.0.0","size_bytes":101},{"artifact_id":"artifact:2:sid","availability":"hash_reference_only","content_sha256":"0000000000000000000000000000000000000000000000000000000000000016","media_type":"application/json","object_sha256":"000000000000000000000000000000000000000000000000000000000000002a","role":"sid","schema_id":"sidscope.sid_space_identity.v1","schema_revision":"1.0.0","size_bytes":102},{"artifact_id":"artifact:3:run","availability":"hash_reference_only","content_sha256":"0000000000000000000000000000000000000000000000000000000000000017","media_type":"application/json","object_sha256":"000000000000000000000000000000000000000000000000000000000000002b","role":"run","schema_id":"sidscope.run_identity.v1","schema_revision":"1.0.0","size_bytes":103},{"artifact_id":"artifact:4:checkpoint","availability":"hash_reference_only","content_sha256":"0000000000000000000000000000000000000000000000000000000000000018","media_type":"application/json","object_sha256":"000000000000000000000000000000000000000000000000000000000000002c","role":"checkpoint","schema_id":"sidscope.checkpoint_binding.v1","schema_revision":"1.0.0","size_bytes":104},{"artifact_id":"artifact:5:trace","availability":"hash_reference_only","content_sha256":"0000000000000000000000000000000000000000000000000000000000000019","media_type":"application/json","object_sha256":"000000000000000000000000000000000000000000000000000000000000002d","role":"trace","schema_id":"sidscope.trace_envelope.v1","schema_revision":"1.0.0","size_bytes":105},{"artifact_id":"artifact:6:diagnostics","availability":"hash_reference_only","content_sha256":"000000000000000000000000000000000000000000000000000000000000001a","media_type":"application/json","object_sha256":"000000000000000000000000000000000000000000000000000000000000002e","role":"diagnostics","schema_id":"sidscope.diagnostic_report.v1","schema_revision":"1.0.0","size_bytes":106},{"artifact_id":"artifact:7:conformance","availability":"embedded_public","content_sha256":"0d8f86599570680ea062ade8dffebac327e7b1f44b8bbcc04a3bb243cc9039c8","media_type":"application/json","object_sha256":"54fad71ce077b55f4bd854f0606801729e708873dd53665e32d2abe6b9771e38","role":"conformance","schema_id":"sidscope.profile_conformance_report.v1","schema_revision":"1.0.0","size_bytes":1223}],"bundle_id":"external:external-parallel:vg","compatibility":{"dataset_identity_sha256":"aaaaaaaaaaaaaaaaaaaaaaaaaaaaaaaaaaaaaaaaaaaaaaaaaaaaaaaaaaaaaaaa","evaluation_cutoff":10,"publication_depth":100,"rank_semantics":"exact_with_censoring","target_universe_sha256":"bbbbbbbbbbbbbbbbbbbbbbbbbbbbbbbbbbbbbbbbbbbbbbbbbbbbbbbbbbbbbbbb"},"content_sha256":"329a4dfd097e874a857e200ec995614a6fa4aad2df0401090543cfbc0a961d26","privacy":{"absolute_private_paths_exported":false,"checkpoint_payload_exported":false,"source_item_ids_exported":false,"source_user_ids_exported":false},"producer":{"name":"third-party.example","version":"0.1.0"},"profile_binding":{"conformance_report_sha256":"0d8f86599570680ea062ade8dffebac327e7b1f44b8bbcc04a3bb243cc9039c8","profile_id":"generator_g0_g5","profile_revision":"1.0.0"},"provenance_edges":[{"from_artifact":"artifact:0:source","relation":"produces","to_artifact":"artifact:1:data"},{"from_artifact":"artifact:1:data","relation":"produces","to_artifact":"artifact:2:sid"},{"from_artifact":"artifact:2:sid","relation":"produces","to_artifact":"artifact:3:run"},{"from_artifact":"artifact:3:run","relation":"produces","to_artifact":"artifact:4:checkpoint"},{"from_artifact":"artifact:4:checkpoint","relation":"produces","to_artifact":"artifact:5:trace"},{"from_artifact":"artifact:5:trace","relation":"produces","to_artifact":"artifact:6:diagnostics"},{"from_artifact":"artifact:6:diagnostics","relation":"produces","to_artifact":"artifact:7:conformance"}],"result_card":{"compute":{"latency_ms":4.0,"nfe":20},"failure_counts":{"generation_search_miss":2,"success":1},"overall_metrics":{"hit_at_10":0.2,"ndcg_at_10":0.1},"rank_observations":{"censored_count":1,"exact_count":2,"exact_ranks":[1,17]},"slice_metrics":{"gap_gt_365d":{"hit_at_10":0.0,"ndcg_at_10":0.0}}},"schema":"sidscope.evidence_bundle.v1","schema_revision":"1.0.0","subject":{"adapter_id":"external-parallel","method_family":"parallel_graph_token_set"},"supersedes":[]}
